PLANT NAME,OPERATING COMPANY,WEBSITE NAME,CONTACT URL
Pilgrim Nuclear Power Plant United States of America,ENTERGY NUCLEAR GENERATION CO.,Richard Miller at Entergy Nuclear Generation Company ...,https://leadferret.com/directory/person/richard-miller/501619556
Point Beach Nuclear Power Plant United States of America,WISCONSIN ELECTRIC POWER CO,We Energies | Contact Us,http://www.we-energies.com/home/contactus.htm
Prairie Island Nuclear Power Plant United States of America,Northern States Power Co.,"Lieser v. Northern States Power Co., 268 Minn. 95 ...",https://www.courtlistener.com/opinion/2168101/lieser-v-northern-states-power-co/
R.E. Ginna Nuclear Power Plant United States of America,CCNPP (Calvert Cliffs Nuclear Power Plant Inc.),estimate radionuclide concentrations: Topics by Science.gov,https://www.science.gov/topicpages/e/estimate+radionuclide+concentrations.html
River Bend Nuclear Power Plant United States of America,ENTERGY GULF States INC.,Entergy | Contact Us,http://www.entergy.com/contact_us/
Saint Lucie Nuclear Power Plant United States of America,Florida Power and Light Co.,Florida Power & Light Electric Services - FPL,https://www.fpl.com/support/contact.html
San Onofre Nuclear Power Plant United States of America,Southern California Edison Co.,Contact Us | Customer Support | Home - SCE,http://www.sce.com/ContactUs/
Seabrook Nuclear Power Plant United States of America,FPL (FLORIDA POWER & LIGHT CO.)/Li>,Contact Your Local LIHEAP Provider For Help - FloridaJobs.org,http://www.floridajobs.org/community-planning-and-development/community-services/low-income-home-energy-assistance-program/contact-your-local-liheap-provider-for-help
Sequoyah Nuclear Power Plant United States of America,TENNESSEE VALLEY AUTHORITY,TVA - Contact Us - Tennessee Valley Authority,https://www.tva.gov/About-TVA/Contact-Us
Surry Nuclear Power Plant United States of America,Virginia Electric and Power Co.,Contact Appalachian Power,https://www.appalachianpower.com/contact/
Susquehanna Nuclear Power Plant United States of America,PENNSYLVANIA POWER & LIGHT CO.,Pennsylvania Power and Light (PPL) - PPL Electric Utilities,https://www.pplelectric.com/my-account/contact-us.aspx
Three Mile Island I Nuclear Power Plant United States of America,"AmerGen Energy Co., LLC",Bruce Williams at AES Corporation Contact Details ...,https://leadferret.com/directory/person/bruce-williams/2570633
Turkey Point Nuclear Power Plant United States of America,Florida Power and Light Co.,Florida Power & Light Electric Services - FPL,https://www.fpl.com/support/contact.html
Vermont Yankee Nuclear Power Plant United States of America,ENTERGY NUCLEAR,Entergy Nuclear - Contact Us,http://www.entergy-nuclear.com/contact_us/
Virgil C. Summer Nuclear Power Plant United States of America,SOUTH CAROLINA ELECTRIC & GAS CO.,Contact Us | SCE&G,https://www.sceg.com/contact
Vogtle Nuclear Power Plant United States of America,Southern Nuclear Operating Co.,Contact Us - Southern Company,http://www.southerncompany.com/contact-us.html
Waterford Nuclear Power Plant United States of America,ENTERGY NUCLEAR,Entergy Nuclear - Contact Us,http://www.entergy-nuclear.com/contact_us/
Watts Bar Nuclear Power Plant United States of America,TENNESSEE VALLEY AUTHORITY,TVA - Contact Us - Tennessee Valley Authority,https://www.tva.gov/About-TVA/Contact-Us
Wolf Creek Nuclear Power Plant United States of America,Kansas Gas and Electric Co.,Contact Us | Heartland - Heartland | Rural Electric ...,https://www.heartland-rec.com/content/contact-us
