PLANT NAME,OPERATING COMPANY,WEBSITE NAME,CONTACT URL
Embalse Nuclear Power Plant Argentina,Nucleoelectrica Argentina SA,argentina uranio mineral molino - lapenera.com,http://www.lapenera.com/ES/argentina_uranio_mineral_molino/
Angra Nuclear Power Plant Brazil,Eletrobras Eletronuclear S.A.  - ELETRONUCLEAR,Brazil's Eletronuclear close to defining Angra 3 business ...,https://www.bnamericas.com/en/news/electricpower/brazils-eletronuclear-close-to-define-angra-3-business-model
Bruce Nuclear Power Plant Canada,Bruce Power,Contact Us - Bruce Power,http://www.brucepower.com/about-us/contact-us/
Darlington Nuclaer Power Plant Canada,Ontario Power Generation,Ontario Power Generation | Contact OPG,https://www.opg.com/Pages/contact.aspx
Gentilly Nuclear Power Plant Canada,Hydro Quebec,Contact us | Hydro-Québec,http://www.hydroquebec.com/contact-us/
Pickering A Nuclear Power Plant Canada,Ontario Power Generation,Ontario Power Generation | Contact OPG,https://www.opg.com/Pages/contact.aspx
Pickering B Nuclear Power Plant Canada,Ontario Power Generation,Ontario Power Generation | Contact OPG,https://www.opg.com/Pages/contact.aspx
Point Lepreau Nuclear Power Plant Canada,New Brunswick Power,Contact Us - NB Power - Language Preference Screen,https://www.nbpower.com/en/contact-us
Changjiang Nuclear Power Plant China,Hainan nuclear power company,China Shows How to Build Nuclear Reactors Fast and Cheap,https://www.forbes.com/sites/jamesconca/2015/10/22/china-shows-how-to-build-nuclear-reactors-fast-and-cheap/#9ee44425484c
China Experimental Fast Reactor (CEFR),China Institute of Atomic Energy,CEDI CHINA GENERAL INFORMATION NAME OF THE FACILITY ...,https://nucleus.iaea.org/sites/lmfns/Facility%20Country%20Profiles1/Profile%20SFR-01%20China%20-%20CEDI.pdf
Fangchenggang Nuclear Power Plant China,Guangxi Fangchenggang Nuclear Power Group,climate change phytoplankton: Topics by Science.gov,http://www.science.gov/topicpages/c/climate+change+phytoplankton.html
Fangjiashan Nuclear Power Plant China,QINSHAN NUCLEAR POWER COMPANY,biron mill power plant contact info coal nuclear,http://www.advisorpublications.co.in/stone/7879/biron-mill-power-plant-contact-info-coal-nuclear.html
Guangdong (Daya Bay) Nuclear Power Plant China,China Guangdong Nuclear Power Corporation (CGNPC),China Guangdong Nuclear Power Holding Corporation (CGNPC),http://cgnpc.chinaexporter.com/contact/
Tianwan (Jiangsu) Nuclear Power Station China,Jiangsu Nuclear Power Corporation,Contact VCollab,http://www.vcollab.com/Company-Info/Company-Profile/CompMech.aspx
Yangjiang Nuclear Power Station China,Yangjiang Nuclear Power Co. Ltd,Shandong Dongstar Group - formwork.com.cn,http://formwork.com.cn/dongstar.asp
Temelin Nuclear Power Plant Czech Republic,Czech Power Company (CEZ),CEZ Group | Contact Points,https://www.cez.cz/en/contacts/contact-points.html
Olkiluoto (TVO) Nuclear Power Plant Finland,Teollisuuden Voima Oy (TVO),TVO | Contact information,http://www.huomisentekijat.fi/Contact-information
Belleville Nuclear Power Plant France,Electricite de France (EdF),EDF Électricité et Gaz: Avis et Contact - Hello Watt,https://www.hellowatt.fr/fournisseurs/edf/
Blayais Nuclear Power Plant France,Electricite de France (EdF),EDF Électricité et Gaz: Avis et Contact - Hello Watt,https://www.hellowatt.fr/fournisseurs/edf/
Bugey Nuclear Power Plant France,Electricite de France (EdF),EDF Électricité et Gaz: Avis et Contact - Hello Watt,https://www.hellowatt.fr/fournisseurs/edf/
Cattenom Nuclear Power Plant France,Electricite de France (EdF),EDF Électricité et Gaz: Avis et Contact - Hello Watt,https://www.hellowatt.fr/fournisseurs/edf/
Chinon Nuclear Power Plant France,Electricite de France (EdF),EDF Électricité et Gaz: Avis et Contact - Hello Watt,https://www.hellowatt.fr/fournisseurs/edf/
Chooz Nuclear Power Plant France,Electricite de France (EdF),EDF Électricité et Gaz: Avis et Contact - Hello Watt,https://www.hellowatt.fr/fournisseurs/edf/
Civaux Nuclear Power Plant France,Electricite de France (EdF),EDF Électricité et Gaz: Avis et Contact - Hello Watt,https://www.hellowatt.fr/fournisseurs/edf/
Cruas Nuclear Power Plant France,Electricite de France (EdF),EDF Électricité et Gaz: Avis et Contact - Hello Watt,https://www.hellowatt.fr/fournisseurs/edf/
Dampierre Nuclear Power Plant France,Electricite de France (EdF),EDF Électricité et Gaz: Avis et Contact - Hello Watt,https://www.hellowatt.fr/fournisseurs/edf/
Fessenheim Nuclear Power Plant France,Electricite de France (EdF),EDF Électricité et Gaz: Avis et Contact - Hello Watt,https://www.hellowatt.fr/fournisseurs/edf/
Flamanville Nuclear Power Plant France,Electricite de France (EdF),EDF Électricité et Gaz: Avis et Contact - Hello Watt,https://www.hellowatt.fr/fournisseurs/edf/
Golfech Nuclear Power Plant France,Electricite de France (EdF),EDF Électricité et Gaz: Avis et Contact - Hello Watt,https://www.hellowatt.fr/fournisseurs/edf/
Gravelines Nuclear Power Plant France,Electricite de France (EdF),EDF Électricité et Gaz: Avis et Contact - Hello Watt,https://www.hellowatt.fr/fournisseurs/edf/
Paluel Nuclear Power Plant France,Electricite de France (EdF),EDF Électricité et Gaz: Avis et Contact - Hello Watt,https://www.hellowatt.fr/fournisseurs/edf/
Penly Nuclear Power Plant France,Electricite de France (EdF),EDF Électricité et Gaz: Avis et Contact - Hello Watt,https://www.hellowatt.fr/fournisseurs/edf/
Saint-Alban Nuclear Power Plant France,Electricite de France (EdF),EDF Électricité et Gaz: Avis et Contact - Hello Watt,https://www.hellowatt.fr/fournisseurs/edf/
Saint-Laurent Nuclear Power Plant France,Electricite de France (EdF),EDF Électricité et Gaz: Avis et Contact - Hello Watt,https://www.hellowatt.fr/fournisseurs/edf/
Tricastin Nuclear Power Plant France,Electricite de France (EdF),EDF Électricité et Gaz: Avis et Contact - Hello Watt,https://www.hellowatt.fr/fournisseurs/edf/
Biblis Nuclear Power Plant Germany,RWE Power AG,RWE AG - Contact,https://www.rwe.com/web/cms/en/77740/rwe-power-ag/contact/
Brokdorf Nuclear Power Plant Germany,E.ON Kernkraft GmbH,Contact & main addresses - E.ON SE,https://www.eon.com/en/contact.html
Grafenrheinfeld Nuclear Power Plant Germany,E.ON Kernkraft GmbH,Contact & main addresses - E.ON SE,https://www.eon.com/en/contact.html
Gundremmingen Nuclear Power Plant Germany,Kernkraftwerk Gundremmingen GmbH,"A Physically Based, One-Dimensional Two-Fluid Model for ...",http://nuclearengineering.asmedigitalcollection.asme.org/article.aspx?articleid=2085829
Isar Nuclear Power Plant Germany,E.ON Kernkraft GmbH,Contact & main addresses - E.ON SE,https://www.eon.com/en/contact.html
Kruemmel Nuclear Power Plant Germany,Kernkraftwerk Kruemmel GmbH & Co. oHG,Handelsregisterauszug von No7 Contact-Lenses (Deutschland ...,https://www.online-handelsregister.de/handelsregisterauszug/he/Frankfurt+am+Main/N/No7+Contact-Lenses+%28Deutschland%29+e.K/2115119
Unterweser Nuclear Power Plant Germany,E.ON Kernkraft GmbH,Contact & main addresses - E.ON SE,https://www.eon.com/en/contact.html
Paks Nuclear Power Plant Hungary,Paksi Atomeromu Rt (http://atomeromu.hu/),atomeromu.hu - Paksi Atomerőmű,http://www.atomeromu.hu/
Kaiga Atomic Power Station India,NUCLEAR POWER CORPORATION OF INDIA LTD (NPCIL),Contact Us - Nuclear Power Corporation of India Limited,https://npcil.etenders.in/pages/contact-us
Kakrapar Atomic Power Station India,NUCLEAR POWER CORPORATION OF INDIA LTD (NPCIL),Contact Us - Nuclear Power Corporation of India Limited,https://npcil.etenders.in/pages/contact-us
Kalpakkam (Madras) Atomic Power Station India,NUCLEAR POWER CORPORATION OF INDIA LTD (NPCIL),Contact Us - Nuclear Power Corporation of India Limited,https://npcil.etenders.in/pages/contact-us
Kudankulam Nuclear Power Plant (KNPP) India,Nuclear Power Corporation Of India Ltd,NUCLEAR POWER CORPORATION OF INDIA LIMITED - Company ...,https://www.zaubacorp.com/company/NUCLEAR-POWER-CORPORATION-OF-INDIA-LIMITED/U40104MH1987GOI149458
Narora Atomic Power Station India,NUCLEAR POWER CORPORATION OF INDIA LTD (NPCIL),Contact Us - Nuclear Power Corporation of India Limited,https://npcil.etenders.in/pages/contact-us
Rajasthan Atomic Power Station Rawatbhata India,NUCLEAR POWER CORPORATION OF INDIA LTD (NPCIL),Contact Us - Nuclear Power Corporation of India Limited,https://npcil.etenders.in/pages/contact-us
Tarapur Atomic Power Station India,NUCLEAR POWER CORPORATION OF INDIA LTD,NUCLEAR POWER CORPORATION OF INDIA LIMITED - Company ...,https://www.zaubacorp.com/company/NUCLEAR-POWER-CORPORATION-OF-INDIA-LIMITED/U40104MH1987GOI149458
Bushehr Nuclear Power Plant Iran,Atomic Energy Organization of Iran,Contact | Iran Watch,http://www.iranwatch.org/contact
Fukushima Daiichi Nuclear Power Plant Japan,Tokyo Electric Power Company Inc. (TEPCO),TEPCO : other | Contact Us Top,http://www.tepco.co.jp/en/other/contact/contop-e.html
Fukushima Daini Nuclear Power Plant Japan,Tokyo Electric Power Company Inc. (TEPCO),TEPCO : other | Contact Us Top,http://www.tepco.co.jp/en/other/contact/contop-e.html
Genkai Nuclear Power Plant Japan,"KYUSHU ELECTRIC POWER CO.,INC.",electrode to contact to an electrolyte on one side and to,https://www.electrochem.org/dl/ma/206/pdfs/0129.pdf
Hamaoka-cho Nuclear Power Plant Japan,"CHUBU ELECTRIC POWER CO.,INC.","Chubu Electric Power Co.,Inc. | Contact Us",http://www.chuden.co.jp/english/contactus/index.html?ceid=gn
Higashi Dori-1 (Tohoku) Nuclear Power Plant Japan,Tohoku Electric Power Company,Contact us | Tohoku Electric Power Website,https://www.tohoku-epco.co.jp/cgi-bin/00002020e/inquiry/toiawase.cgi?about=e-contact-us
Ikata Nuclear Power Station Japan,"SHIKOKU ELECTRIC POWER CO.,INC","Shikoku Electric Power Co. Inc. - Overview, Contact ...",https://www.researchmoz.us/shikoku-electric-power-co-inc-overview-contact-details-locations-key-executives-power-plant-information-business-description-and-swot-analysis-report.html
Kashiwazaki Kariwa Nuclear Power Plant Japan,Tokyo Electric Power Company Inc. (TEPCO),TEPCO : other | Contact Us Top,http://www.tepco.co.jp/en/other/contact/contop-e.html
Mihama Nuclear Power Plant Japan,KANSAI ELECTRIC POWER CO.,Contact us [KEPCO],http://www.kepco.co.jp/english/corporate/info/procurement/iqcounter/index.html
Mihama Nuclear Power Plant Japan,KANSAI ELECTRIC POWER CO.,Contact us [KEPCO],http://www.kepco.co.jp/english/corporate/info/procurement/iqcounter/index.html
Ignalina Nuclear Power Plant Lithuania,IGNALINA NUCLEAR POWER PLANT,Lithuania: Ignalina N-plant auction case goes to court,https://www.baltictimes.com/lithuania__ignalina_n-plant_auction_case_goes_to_court/
Laguna Verde Nuclear Power Plant Mexico,COMISION FEDERAL DE ELECTRICIDAD,What does CFE stand for? - abbreviations.com,https://www.abbreviations.com/CFE
Borssele Nuclear Power Plant Netherlands,N.V. ELEKTRICITEITS-PRODUKTIEMAATSCHAPPIJ ZUID-NEDERLAND,Contact – Blik in de bol,https://blikindebol.nl/portfolio/items/contact/
Chasnupp Nuclear Power Plant Pakistan,PAKISTAN ATOMIC ENERGY COMMISSION,Contact Us - Pakistan Atomic Energy Commission,http://www.paec.gov.pk/contact/index.aspx
Kanupp Nuclear Power Reactor Pakistan,PAKISTAN ATOMIC ENERGY COMMISSION,Contact Us - Pakistan Atomic Energy Commission,http://www.paec.gov.pk/contact/index.aspx
Chinshan Nuclear Power Plant Taiwan,Taipower (TAIWAN POWER CO.),Taiwan power company-Contact us,http://www.taipower.com.tw/e_content/content/contact/contact01.aspx
Kuosheng Nuclear Power Plant Taiwan,TPC (TAIWAN POWER CO.),Contact | Yokogawa Global,https://www.yokogawa.com/tpc/contactus/
Lungmen Nuclear Power Plant Taiwan,Taiwan Power Company,Taiwan power company-Contact us,http://www.taipower.com.tw/e_content/content/contact/contact01.aspx
Maanshan Nuclear Power Plant Taiwan,TPC (TAIWAN POWER CO.),Contact | Yokogawa Global,https://www.yokogawa.com/tpc/contactus/
Hanbit (Yonggwang) Nuclear Power Plant South Korea,Korea Electric and Power Company (KEPCO),Contact Us | Kepco Philippines,http://kepcophilippines.com/contact-us
Hanul (Ulchin) Nuclear Power Plant Korea,Korea Hydro and Nuclear Power Co.,Patent US8085895 - Spacer grid spring for increasing the ...,http://www.google.com/patents/US8085895
Kori Nuclear Power Plant Korea,Korea Hydro and Nuclear Power Co.,Patent US8085895 - Spacer grid spring for increasing the ...,http://www.google.com/patents/US8085895
Shin-Kori Nuclear Power Plant South Korea,Korea Hydro & Nuclear Power,Korea Hydro Nuclear Power Abu Dhabi Hr Office Email ...,http://uae-jobs.jobzed.com/search/korea-hydro-nuclear-power-abu-dhabi-hr-office-email-contact/
Shin-Wolsong Nuclear Power Plant South Korea,Korea Hydro and Nuclear Power Co.,Patent US8085895 - Spacer grid spring for increasing the ...,http://www.google.com/patents/US8085895
Wolsong Nuclear Power Plant Korea,Korea Hydro and Nuclear Power Co.,Patent US8085895 - Spacer grid spring for increasing the ...,http://www.google.com/patents/US8085895
Cernavoda Nuclear Power Plant Romania,SOCIETATEA NATIONALA NUCLEARELECTRICA S.A.,"I.1) DENUMIREA, ADRESA SI PUNCT(E) DE CONTACT: Societatea ...",http://www.ziuaconstanta.ro/images/stories/2015/12/27/rodica/licitatie.pdf
Balakovo Nuclear Power Plant  Russia,Energoatom (previously ROSENERGOATOM) www.rosenergoatom.ru,АО «Концерн Росэнергоатом»,http://www.rosenergoatom.ru/
Beloyarskiy Nuclear Power Plant Russia,Energoatom (previously ROSENERGOATOM) www.rosenergoatom.ru,АО «Концерн Росэнергоатом»,http://www.rosenergoatom.ru/
Bilibino Nuclear Power Plant  Russia,Energoatom (previously ROSENERGOATOM) www.rosenergoatom.ru,АО «Концерн Росэнергоатом»,http://www.rosenergoatom.ru/
Kalinin Nuclear Power Plant Russia,Energoatom (previously ROSENERGOATOM) www.rosenergoatom.ru,АО «Концерн Росэнергоатом»,http://www.rosenergoatom.ru/
Kola Nuclear Power Plant Russia,Energoatom (previously ROSENERGOATOM) www.rosenergoatom.ru,АО «Концерн Росэнергоатом»,http://www.rosenergoatom.ru/
Kursk Nuclear Power Plant Russia,Energoatom (previously ROSENERGOATOM) www.rosenergoatom.ru,АО «Концерн Росэнергоатом»,http://www.rosenergoatom.ru/
Leningrad Nuclear Power Plant Russia,Energoatom (previously ROSENERGOATOM) www.rosenergoatom.ru,АО «Концерн Росэнергоатом»,http://www.rosenergoatom.ru/
Novovoronezh Nuclear Power Plant Russia,Energoatom (previously ROSENERGOATOM) www.rosenergoatom.ru,АО «Концерн Росэнергоатом»,http://www.rosenergoatom.ru/
Rostov (Volgodonsk) Nuclear Power Plant Russia,Energoatom (previously ROSENERGOATOM) www.rosenergoatom.ru,АО «Концерн Росэнергоатом»,http://www.rosenergoatom.ru/
Smolensk Nuclear Power Plant Russia,Energoatom (previously ROSENERGOATOM) www.rosenergoatom.ru,АО «Концерн Росэнергоатом»,http://www.rosenergoatom.ru/
Krsko Nuclear Power Reactor Slovenia,NUKLEARNA ELEKTRARNA KRSKO,IDOM | Contact & Offices addresses,https://www.idom.com/contact/
Koeberg Nuclear Power Plant South Africa,Eskom,Leaders at South Africa's Eskom Promise Sweep Lenders Seek ...,https://www.bloomberg.com/news/articles/2018-01-30/leaders-at-south-africa-s-eskom-promise-clean-sweep-lenders-seek
SAFARI-1 Research Reactor South Africa,The South African Nuclear Energy Corporation (NECSA),Contact Us - Necsa,http://necsa.co.za/About-US/Contact-Us
Asco Nuclear Power Plant Spain,Asociacion Nuclear Asco-Vandellos (ANAV),Contact - ANAV,http://anav.es/en/contact/
Cofrentes Nuclear Power Plant Spain,"IBERDROLA, S.A.",Contact number - Iberdrola,https://www.iberdrola.com/contact
Vandellos Nuclear Power Plant Spain,ANAV (Asociacion Nuclear Asco-Vandellos),Contact - ANAV,http://anav.es/en/contact/
Forsmark Nuclear Power Plant Sweden,FORSMARK KRAFTGRUPP AB,Medarbetare till Byggkonstruktion på Forsmarks Kraftgrupp AB,https://corporate.vattenfall.com/careers/jobs/search-for-jobs/medarbetare-till-byggkonstruktion-pa-forsmarks-kraftgrupp-ab/
Oskarshamn Nuclear Power Plant Sweden,OKG AKTIEBOLAG,OKG - Contact,http://www.okg.se/en/About-OKG/Contact/
Ringhals Nuclear Power Plant Sweden,Ringhals AB,"Visit and contact us, Ringhals - Vattenfall",https://corporate.vattenfall.se/om-oss/var-verksamhet/var-elproduktion/ringhals/ringhals-nuclear-power-plant/visit-and-contact-us/
Beznau Nuclear Power Plant Switzerland,NOK NORDOSTSCHWEIZERISCHE KRAFTWERKE,Nok - Nordostschweizerische Kraftwerke - (contact Not ...,http://www.eurekanetwork.org/content/nok-nordostschweizerische-kraftwerke-contact-not-available
Goesgen Nuclear Power Plant Switzerland,KERNKRAFTWERK GOESGEN-DAENIKEN AG,CONTACT ENERGY LTD.: International Competitive Benchmarks ...,https://www.amazon.ca/CONTACT-ENERGY-LTD-International-Competitive/dp/0597364257
Leibstadt Nuclear Power Plant Switzerland,KERNKRAFTWERK LEIBSTADT,Contact - sax.ch,https://www.sax.ch/fr/Entreprise/contact.html
Muehlberg Nuclear Power Plant Switzerland,BKW ENERGIE AG,BKW: Contact,https://www.bkw.ch/en/seite/contact/
Khmelnitskiy Nuclear Power Plant Ukraine,National Nuclear Energy Generating Company Energoatom (NNEGC Energoatom),THE FOLLOWING APPLIES TO GOODS AND RELATED ... - Energoatom,http://www.energoatom.kiev.ua/files/file/invitation_for_tenders_rfp_23201_156_goods_1_eng_rev.4.pdf
Rovno (Rivne) Nuclear Power Plant Ukraine,National Nuclear Energy Generating Company Energoatom (NNEGC Energoatom),THE FOLLOWING APPLIES TO GOODS AND RELATED ... - Energoatom,http://www.energoatom.kiev.ua/files/file/invitation_for_tenders_rfp_23201_156_goods_1_eng_rev.4.pdf
South Ukraine Nuclear Power Plant Ukraine,National Nuclear Energy Generating Company Energoatom (NNEGC Energoatom),THE FOLLOWING APPLIES TO GOODS AND RELATED ... - Energoatom,http://www.energoatom.kiev.ua/files/file/invitation_for_tenders_rfp_23201_156_goods_1_eng_rev.4.pdf
Zaporozhye Nuclear Power Plant Ukraine,National Nuclear Energy Generating Company Energoatom (NNEGC Energoatom),THE FOLLOWING APPLIES TO GOODS AND RELATED ... - Energoatom,http://www.energoatom.kiev.ua/files/file/invitation_for_tenders_rfp_23201_156_goods_1_eng_rev.4.pdf
Hunterston-B Nuclear Power Plant United Kingdom,BRITISH ENERGY,BP - Official Site,https://www.bp.com/
Oldbury Nuclear Power Plant United Kingdom (Shutdown),BRITISH NUCLEAR FUELS LIMITED,Contact Address of British Nuclear Fuel Limited in ...,https://addresscustomerservicecenternumber.com/Address-Email-Website-Contact-Number-of-British-Nuclear-Fuel-Limited-in-Richland-WA/
Sizewell A Nuclear Power Plant UK (Shutdown),BRITISH NUCLEAR FUELS LIMITED,Handmark Engineering Contact,http://www.handmarkengineering.co.uk/contact.php
Wylfa Nuclear Power Plant United Kingdom,BRITISH NUCLEAR FUELS LIMITED,Handmark Engineering Contact,http://www.handmarkengineering.co.uk/contact.php
Arkansas Nuclear Power Plant United States of America,"Entergy Arkansas, Inc. for unit 1, ENTERGY (ENTERGY NUCLEAR) for unit 2",www.gpo.gov,https://www.gpo.gov/fdsys/pkg/FR-2002-09-18/mods.xml
Beaver Valley Nuclear Power Plant United States of America,FIRST ENERGY NUCLEAR OPERATING CO.,Contact Address of Firstenergy Nuclear Operating Company ...,https://addresscustomerservicecenternumber.com/Address-Email-Website-Contact-Number-of-Firstenergy-Nuclear-Operating-Company-in-Reading-PA/
Braidwood Nuclear Power Plant United States of America,Exelon Generation,Contact: Paul Adams FOR IMMEDIATE RELEASE Exelon Corporate ...,http://www.exeloncorp.com/newsroom/Documents/Exelon%20Generation%20Statement%20on%20EGTP%20-%2011.7.17.pdf
Browns Ferry Nuclear Power Plant United States of America,TENNESSEE VALLEY AUTHORITY,TVA - Contact Us - Tennessee Valley Authority,https://www.tva.gov/About-TVA/Contact-Us
Brunswick Nuclear Power Plant United States of America,"Progress Energy Carolinas, Inc.",Contact Us | Progress Energy Canada Ltd.,http://www.progressenergy.com/contact-us/
Byron Nuclear Power Plant United States of America,Exelon Generation,"Exelon Generation Co Llc XDate, Carrier History, Mod ...",https://www.insurancexdate.com/GA/epb1Z/exelon-generation-co-llc-atlanta
Callaway Nuclear Power Plant United States of America,AMERGEN ENERGY GENERATING CO.,Contact Center Benchmarking Network | Book and List,http://ccbn.org/xxxyyyzzz
Calvert Cliffs Nuclear Power Plant United States of America,Calvert Cliffs Nuclear Power Plant Inc.,Federal Register - GPO,https://www.gpo.gov/fdsys/pkg/FR-1998-05-12/mods.xml
Catawba Nuclear Power Plant United States of America,DUKE POWER CO.,Outage Reporting - Duke Energy,https://ols.duke-energy.com/037/ExtOutageReporting/ExtOutageReportingServlet
Clinton Nuclear Power Plant United States of America,Amergen Energy Generating Co.,Contact Center Benchmarking Network | Book and List,http://ccbn.org/xxxyyyzzz
Columbia Nuclear Power Plant United States of America,Energy Northwest,Contact Us - Energy Northwest,http://www.energy-northwest.com/Pages/Contact-Us.aspx
Comanche Peak Nuclear Power Plant United States of America,"Luminant Generation, a subsidiary of Energy Future Holdings Corporation",Contact Txu Houston - allcontactphonenumbers.com,https://allcontactphonenumbers.com/Contact-Txu-Houston/
Cooper Nuclear Power Plant United States of America,NPPD (NEBRASKA PUBLIC POWER DISTRICT),Contact Us - Nebraska Public Power District,http://www.nppd.com/contact-us/customer-service-centers/
Davis-Besse Nuclear Power Plant United States of America,FIRST ENERGY NUCLEAR OPERATING CO.,Contact Address of Firstenergy Nuclear Operating Company ...,https://addresscustomerservicecenternumber.com/Address-Email-Website-Contact-Number-of-Firstenergy-Nuclear-Operating-Company-in-Reading-PA/
Diablo Canyon Nuclear Power Plant United States of America,Pacific Gas & Electric Co.,Contact us - Pacific Gas and Electric Company,https://www.pge.com/en_US/residential/customer-service/help/contact-pge-landing/contact-us.page
Duane Arnold Nuclear Power Plant United States of America,FPL ENERGY DUANE ARNOLD,"NextEra Energy Resources, LLC -Overview, Contact Details ...",https://www.researchmoz.us/nextera-energy-resources-llc-overview-contact-details-locations-key-executives-power-plant-information-business-description-and-swot-analysis-report.html
Edwin I. Hatch Nuclear Power Plant United States of America,Southern Nuclear Operating Co.,Contact Us - Southern Company,http://www.southerncompany.com/contact-us.html
Enrico Fermi Nuclear Power Plant United States of America,DETROIT EDISON CO.,DTE Energy | Contact Us,https://www.newlook.dteenergy.com/wps/wcm/connect/dte-web/quicklinks/footer/03%2Bcontact%2Bus
Fitzpatrick Nuclear Power Plant USA,"Entergy Nuclear Operations, Inc.",Entergy | Contact Us,http://www.entergy.com/contact_us/
Fort Calhoun Nuclear Power Plant United States of America,Omaha Public Power District,Contact,http://www.oppd.com/contact/
Grand Gulf Nuclear Power Plant United States of America,ENTERGY NUCLEAR,Entergy Nuclear - Contact Us,http://www.entergy-nuclear.com/contact_us/
H. B. Robinson Nuclear Power Plant United States of America,Progress Energy Corporation,Contact Us | Progress Energy Canada Ltd.,http://www.progressenergy.com/contact-us/
Hope Creek Nuclear Power Plant United States of America,PUBLIC SERVICE ELECTRIC & GAS CO.,PSE&G Contact Information for our New Jersey Customers,https://pseg.com/info/contact.jsp
Indian Point Nuclear Power Plant United States of America,ENTERGY NUCLEAR,Entergy Nuclear - Contact Us,http://www.entergy-nuclear.com/contact_us/
Joseph M. Farley Nuclear Power Plant United States of America,ALP (ALABAMA POWER CO.),REA Energy | Proudly Serving Members for Over 75 Years,http://www.reaenergy.com/
Kewaunee Nuclear Power Plant United States of America,DOMINION ENERGY KEWAUNEE,www.gpo.gov,https://www.gpo.gov/fdsys/pkg/FR-2010-02-05/mods.xml
LaSalle Nuclear Power Plant United States of America,Exelon Generation,"Exelon Generation Co Llc XDate, Carrier History, Mod ...",https://www.insurancexdate.com/GA/epb1Z/exelon-generation-co-llc-atlanta
Limerick Nuclear Power Plant United States of America,Exelon Generation,"Exelon Generation Co Llc XDate, Carrier History, Mod ...",https://www.insurancexdate.com/GA/epb1Z/exelon-generation-co-llc-atlanta
McGuire Nuclear Power Plant United States of America,DUKE POWER CO.,Outage Reporting - Duke Energy,https://ols.duke-energy.com/037/ExtOutageReporting/ExtOutageReportingServlet
Millstone Nuclear Power Plant United States of America,Dominion Virginia Power,Contact of Dominion Virginia Power customer service ...,http://customercarecontacts.com/contact-of-dominion-virginia-power-customer-service/
Monticello Nuclear Power Plant United States of America,Northern States Power Co.,"Lieser v. Northern States Power Co., 268 Minn. 95 ...",https://www.courtlistener.com/opinion/2168101/lieser-v-northern-states-power-co/
North Anna Nuclear Power Plant United States of America,VIRGINIA ELECTRIC POWER CO.,Contact Appalachian Power,https://www.appalachianpower.com/contact/
Oconee Nuclear Power Plant United States of America,DUKE POWER CO.,Outage Reporting - Duke Energy,https://ols.duke-energy.com/037/ExtOutageReporting/ExtOutageReportingServlet
Oyster Creek Nuclear Power Plant United States of America,Exelon Corporation,Suppliers - Contact Information - Exelon,http://www.exeloncorp.com/suppliers/contact-information
Palo Verde Nuclear Power Plant United States of America,ARIZONA PUBLIC SERVICE CO.,"Contact Arizona Public Service Co | Fastest, No Wait Time",https://gethuman.com/contact/Arizona-Public-Service-Co
Peach Bottom Nuclear Power Plant United States of America,Exelon Generation,"Exelon Generation Co Llc XDate, Carrier History, Mod ...",https://www.insurancexdate.com/GA/epb1Z/exelon-generation-co-llc-atlanta
Perry Nuclear Power Plant United States of America,FIRST ENERGY NUCLEAR OPERATING CO.,Contact Address of Firstenergy Nuclear Operating Company ...,https://addresscustomerservicecenternumber.com/Address-Email-Website-Contact-Number-of-Firstenergy-Nuclear-Operating-Company-in-Reading-PA/
