
Wave1,Corrections,ru,de,es,fr
Wave1,Corrections,Исправительные меры,Korrekturen,Correcciones,Corrections
_went,"""ent"" (as in cli-ent)",(как в CLI-интерфейсе),ent (wie in CLI-ent),ENT (como en CLI-ENT),ent (comme dans CLI-ENT)
_suce,“u” - consonant - “e”,u-согласные-e,u-Konsonanten-e,u-consonante-e,u-consonne-e
_wfs,"a (long a), which is also called a faded schwa","a (длинный a), который также называется потерянным счва","a (Long a), die auch als verblasst Schwa","a (largo a), que también se llama un Schwa desteñido","a (long a), qui est aussi appelé un schwa fanée"
_sa,a (sound short),a (звучит коротко),a (Ton kurz),a (sonido corto),a (son court)
_sacsio,A closed syllable is one in which a vowel is followed by one or more consonants.,"Закрытый слог — это один из них, в котором за гласными следуют один или несколько согласных.","Eine geschlossene Silbe ist ein, in dem ein Vokal von einem oder mehreren Konsonanten gefolgt wird.",Una sílaba cerrada es una en la que una vocal es seguida por una o más consonantes.,Une syllabe fermée est celle dans laquelle une voyelle est suivie d'une ou plusieurs consonnes.
_saone1,"A one syllable word that ends in a vowel is ""an"" open syllable, for example: ""me"" = m","Одно слоговое слово, заканчивающееся гласным, является открытым слогом, например: Me = m","Eine Silbe Wort, die mit einem Vokal endet, ist eine offene Silbe, zum Beispiel: Me = m","Una palabra de una sílaba que termina en una vocal es una sílaba abierta, por ejemplo: me = m","Un mot d'une syllabe qui se termine par une voyelle est une syllabe ouverte, par exemple: me = m"
_sasaca,"A syllable always contains a vowel and can ""be"" said in one breath.",Слог всегда содержит гласные и может быть сказано в одном дыхании.,Eine Silbe enthält immer einen Vokal und kann in einem Atemzug gesagt werden.,Una sílaba contiene siempre una vocal y se puede decir en una respiración.,Une syllabe contient toujours une voyelle et peut être dit dans un souffle.
_sasiaw,"A syllable is a word, or part of a word.",Слог-это слово или часть слова.,Eine Silbe ist ein Wort oder ein Teil eines Wortes.,"Una sílaba es una palabra, o parte de una palabra.","Une syllabe est un mot, ou une partie d'un mot."
_sastca,"A syllable that contains a vowel, a consonant and a ""siltne"" ""e"" is called a ""vce"" syllable.","Слог, содержащий гласную, согласный и силтне e называется ВЦЕ слогом.","Eine Silbe, die einen Vokal, einen Konsonanten und eine siltne e enthält, wird als VCE Silbe bezeichnet.","Una sílaba que contiene una vocal, una consonante y un siltne e se llama una sílaba de VCE.","Une syllabe contenant une voyelle, une consonne et une siltne e est appelée syllabe VCE."
_saswav,"A syllable with a vowel at the end of it is called ""an"" open syllable.",Слог с гласным в конце его называют открытым слогом.,Eine Silbe mit einem Vokal am Ende wird als offene Silbe bezeichnet.,Una sílaba con una vocal en el extremo de ella se llama una sílaba abierta.,Une syllabe avec une voyelle à la fin de celui-ci est appelée une syllabe ouverte.
_sawmah,A word must always have a vowel sound.,Слово всегда должно иметь гласный звук.,Ein Wort muss immer einen Vokal haben.,Una palabra debe tener siempre un sonido vocal.,Un mot doit toujours avoir un son de voyelle.
_sawwtl,"A word represented by the letters ""cvc"" is made ""up"" with (a consonant , ""avowel"", and a consonant).","Слово, представленное буквами КВК, состоит из (согласных, авовел и согласных).","Ein Wort, das durch die Buchstaben CVC dargestellt wird, wird mit (einem Konsonanten, avowel und einem Konsonanten) gebildet.","Una palabra representada por las letras CVC se compone con (una consonante, avowel, y una consonante).","Un mot représenté par les lettres CVC est composé de (une consonne, avowel, et une consonne)."
_saeiou,"""A"", ""e"", ""i"", ""o"", and ""u"".","А, Рик, я, о, и ты.","A, e, i, o und du.","A, e, yo, o, y tú.","A, e, i, o, et toi."
_lable,able (the letters),возможность (буквы),fähig (die Buchstaben),able (las letras),able (les lettres)
_safb,about final blends.,о финальных смешениях.,über Final Blends.,Acerca de las mezclas finales.,à propos des mélanges finaux.
_saib,about initial blends.,о начальных переходах.,über anfängliche blenden.,Acerca de las mezclas iniciales.,sur les mélanges initiaux.
_satdr,about the doubling rule.,о правиле удвоения.,über die doppelte Regel.,sobre la regla de doblaje.,sur la règle de doublement.
_sitlywl,about word blends.,о программе Word Blend.,über Word Blends.,Acerca de las mezclas de palabras.,à propos des mélanges de mots.
_saavtm,"Add a vowel (a,""e"",""i"",""o"" or ""u"") to make a word.","Добавить гласные (a, e, i, o или u), чтобы сделать слово.","Fügen Sie einen Vokal (a, e, i, o oder u) ein, um ein Wort zu machen.","Añada una vocal (a, e, i, o u u) para hacer una palabra.","Ajouter une voyelle (a, e, i, o ou u) pour faire un mot."
_saytyc,"After you type your choice, I will give you the correct choice for spelling.",После ввода выбранного варианта я дам вам правильный выбор для написания.,"Nachdem Sie Ihre Wahl eingegeben haben, werde ich Ihnen die richtige Wahl für die Rechtschreibung geben.","Después de que usted teclee su opción, le daré la opción correcta para deletrear.","Après que vous tapez votre choix, je vous donnerai le bon choix pour l'orthographe."
_sasitw,"Again, separate the words into syllables, read one syllable at a time, and then blend into a whole word.","Снова разделите слова на слоги, прочитайте один слог за раз, а затем переходите в целое слово.","Wiederum trennen Sie die Wörter in Silben, lesen Sie jeweils eine Silbe, und vermischen Sie sich dann in ein ganzes Wort.","Una vez más, separar las palabras en sílabas, leer una sílaba a la vez, y luego mezclar en una palabra entera.","Encore une fois, séparer les mots en syllabes, lire une syllabe à la fois, puis se fondre dans un mot entier."
_lai,"""ai"" (the letters)",Ай (буквы),Ai (die Buchstaben),AI (las letras),ai (les lettres)
_sai,"""ai"" (the sounds)",AI (звуки),Ai (die Klänge),AI (los sonidos),ai (les sons)
_lald,"""ald"" (the letters)",НОП (буквы),ALD (die Buchstaben),ALD (las letras),ALD (les lettres)
_lalk,"""alk"" (the letters)",АЛК (буквы),ALK (die Buchstaben),alcalino (las letras),ALK (les lettres)
_lall,all (the letters),все (буквы),Alle (die Buchstaben),todos (las letras),tous (les lettres)
_saotlvs,all of the long vowel sounds which are closed syllable exceptions,"все длинные гласные звуки, которые являются исключениями из закрытого слога","alle langen Vokal-Töne, die geschlossene Silbe Exceptions sind",todos los sonidos largos de la vocal que son excepciones cerradas de la sílaba,toutes les voyelles longues qui sont fermées exceptions SYLLABE
_saatws,"All of these words should ""be"" memorized.",Все эти слова следует запоминать.,Alle diese Wörter sollten auswendig gelernt werden.,Todas estas palabras deben memorizarse.,Tous ces mots doivent être mémorisés.
_sasmha,All syllables must have a vowel.,Все слоги должны быть гласными.,Alle Silben müssen einen Vokal haben.,Todas las sílabas deben tener una vocal.,Toutes les syllabes doivent avoir une voyelle.
_satdyh,"all the digraphs you have learned ""so"" far.","все, что вы узнали до сих пор.","Alle Digraphen, die Sie bisher gelernt haben.",todos los digramas que has aprendido hasta ahora.,tous les digraphes que vous avez appris jusqu'ici.
_sallth,"All the syllables in these words will ""be"" closed; therefore the vowels will be short.",Все слоги в этих словах будут закрыты; Поэтому гласные будут короткими.,Alle Silben in diesen Wörtern werden geschlossen; Daher werden die Vokale kurz sein.,Todas las sílabas en estas palabras serán cerradas; por lo tanto las vocales serán cortas.,"Toutes les syllabes de ces mots seront fermées; par conséquent, les voyelles seront courtes."
_satvty,"all the vowel teams you have learned ""so"" far.","все гласные команды, которые вы узнали до сих пор.","alle Vokal-Teams, die Sie bisher gelernt haben.",todos los equipos vocales que has aprendido hasta ahora.,toutes les voyelles que vous avez apprises jusqu'ici.
_satvty1,all the vowel teams you worked with in the previous lessons.,"все гласные команды, с которыми вы работали на предыдущих уроках.","alle Vokal-Teams, mit denen Sie in den vorangegangenen Lektionen gearbeitet haben.",todos los equipos vocales con los que trabajaste en las lecciones anteriores.,toutes les voyelles avec lesquelles vous avez travaillé dans les leçons précédentes.
_satmtss,All three make the same sound.,Все три делают один и тот же звук.,Alle drei machen denselben Klang.,Los tres hacen el mismo sonido.,Les trois font le même bruit.
_lalm,"""alm"" (the letters)",Управление жизненным циклом приложений (письма),Alm (die Buchstaben),ALM (las letras),Alm (les lettres)
_salmos,"Almost all of the words you have practiced ""so"" far have been one syllable.","Почти все слова, которые вы практиковали до сих пор, были одним слогом.","Fast alle Wörter, die Sie bisher praktiziert haben, waren eine Silbe.",Casi todas las palabras que has practicado hasta ahora han sido una sílaba.,Presque tous les mots que vous avez pratiqué jusqu'ici ont été une syllabe.
_saitwf,"Also, in the word full, the short ""u"" sound is affected by the ""l"".","Кроме того, в слове «полный текст» на короткое u влияет l.","Auch im Wort voll, der kurze u-Klang wird von der l beeinflusst.","También, en la palabra Full, el sonido de u corto es afectado por el l.","Aussi, dans le mot plein, le son court u est affectée par le l."
_sarttv,"Also, remember that some vowel teams can make more than one sound.","Кроме того, помните, что некоторые гласные команды могут делать более одного звука.","Beachten Sie auch, dass einige Vokal-Teams mehr als einen Klang machen können.","Además, recuerde que algunos equipos vocales pueden hacer más de un sonido.","Aussi, rappelez-vous que certaines équipes de voyelles peuvent faire plus d'un son."
_lalt,alt (the letters),Alt (буквы),alt (die Buchstaben),Alt (las letras),Alt (les lettres)
_salway,Always blend the word syllable by syllable.,Всегда накладываем слово слог по слогам.,Blende immer die Wort-Silbe durch Silbe ein.,Siempre mezcle la palabra sílaba por sílaba.,Toujours mélanger le mot syllabe par syllabe.
_sasiat,"""An"" ""s"" is added to the end of the word to make it plural.","К концу слова добавляется s, чтобы сделать его множественным.","Ein s wird am Ende des Wortes hinzugefügt, um es Plural zu machen.",Se añade un s al final de la palabra para que sea plural.,Un s est ajouté à la fin du mot pour le rendre pluriel.
_saeitw,"""An"" example is the word ""patch"", which has a short ""a"".","Примером является исправление Word, которое имеет короткий a.","Ein Beispiel ist der Word-Patch, der ein kurzes a aufweist.","Un ejemplo es la palabra patch, que tiene un corto a.","Un exemple est le mot patch, qui a un court a."
_sanope,"""An"" open syllable ends with a vowel, and that vowel is long.","Открытый слог заканчивается гласным, а гласный-длинный.","Eine offene Silbe endet mit einem Vokal, und der Vokal ist lang.","Una sílaba abierta termina con una vocal, y esa vocal es larga.","Une syllabe ouverte se termine par une voyelle, et cette voyelle est longue."
_sap,"and ""p"" ...(are consonants.) (the letters ""t"")...",и с... (согласные.) (буквы t)...,und p ... (sind Konsonanten.) (die Buchstaben t) ...,y p ... (son consonantes.) (las letras t) ...,et p ... (sont des consonnes.) (les lettres t) ...
_saac,and a consonant.,и согласные.,und einen Konsonanten.,y una consonante.,et une consonne.
_sastls,And say the letter sound...,"И сказать, что письмо звучит...","Und sagen, der Buchstabe Klang ...",Y dicen que el sonido de la letra ...,Et dire le son de la lettre ...
_sastls1,And say the letters sound...,"И сказать, что буквы звучат...",Und sagen die Buchstaben Klang ...,Y dicen que las letras suenan ...,Et dire les lettres sonores ...
_satbod,"and the blend or digraph (""Hint3"").",и смесь или расграфа (хинт3).,und die Mischung oder Digraph (Hint3).,y la mezcla o el digrama (Hint3).,et le mélange ou le digramme (Hint3).
_satc,"and the consonant (""Hint3"").",и согласный (хинт3).,und den Konsonanten (Hint3).,y la consonante (Hint3).,et la consonne (Hint3).
_satv,"and the vowel (""Hint3"")",и гласный (хинт3),und der Vokal (Hint3),y la vocal (Hint3),et la voyelle (Hint3)
_savwtl,"and vowels with the letter ""v"". (""We"" will represent consonants with the letter ""c"")",и гласные с буквой v. (мы будем представлять согласные с буквой c),und Vokale mit dem Buchstaben v. (wir werden Konsonanten mit dem Buchstaben c repräsentieren),y vocales con la letra v. (representaremos consonantes con la letra c),et des voyelles avec la lettre v. (Nous représenterons les consonnes avec la lettre c)
_wand1,"and...(""Hint3"") (used in Syllables, Break ""3"")","и... (хинт3) (используется в слогах, разрыв 3)","und ... (Hint3) (wird in Silben, Break 3 verwendet)","y ... (Hint3) (utilizado en sílabas, rotura 3)","et ... (Hint3) (utilisé en syllabes, Break 3)"
_lang,"""ang"" (the letters)",угол (буквы),ang (die Buchstaben),Ang (las letras),ang (les lettres)
_sang,"""ang"" (the sounds)",угол (звуки),ang (die Klänge),Ang (los sonidos),ang (les sons)
_lank,"""ank"" (the letters)",АНК (буквы),ANK (die Buchstaben),ANK (las letras),ANK (les lettres)
_sank,"""ank"" (the sounds)",АНК (звуки),ANK (die Klänge),ANK (los sonidos),ANK (les sons)
_sadiwt,another digraph in which the consonants do have separate sounds.,"еще одна расграфа, в которой согласные имеют отдельные звуки.","ein anderes Digraph, in dem die Konsonanten getrennte Töne haben.",otro digrama en el que las consonantes tienen sonidos separados.,un autre digramme dans lequel les consonnes ont des sons distincts.
_saetvt,another exception to vowel team rules.,еще одно исключение из правил для гласных команд.,eine weitere Ausnahme zu Vokal-Team Regeln.,otra excepción a las reglas del equipo vocal.,une autre exception aux règles de l'équipe de voyelles.
_saniyt,"Answer ""no"" if you think the doubling rule does not apply to the word.","Ответ нет, если вы считаете, что правило удвоения не применяется к слову.","Antwort Nein, wenn Sie denken, die doppelte Regel gilt nicht für das Wort.",Respuesta no si cree que la regla de duplicación no se aplica a la palabra.,Réponse non si vous pensez que la règle de doublement ne s'applique pas au mot.
_sayiyt,Answer yes if you think the doubling rule applies to the word.,"Ответьте Да, если вы считаете, что правило удвоения применяется к слову.","Beantworten Sie ja, wenn Sie denken, die doppelte Regel gilt für das Wort.",Responda sí si cree que la regla de duplicación se aplica a la palabra.,Réponse oui si vous pensez que la règle de doublement s'applique au mot.
_sacrcs,"are called ""r""-controlled syllables (Syllables that contain the letters...(""ar""/""er""/""ir"", ""etc"") ...","называются подконтрольными слогами r (слоги, содержащие буквы... (AR/ER/ИК и т. д.)...","nennt man r-kontrollierte Silben (Silben, die die Buchstaben enthalten ...) (AR/er/IR, etc) ...","se llaman las sílabas r-controladas (las sílabas que contienen las letras ...) (ar/er/ir, etc) ...","sont appelés des syllabes r-Controlled (syllabes qui contiennent les lettres ...) (AR/er/IR, etc) ..."
_sac,"are consonants. (the letters ""t"" and ""p"")",согласны. (буквы t и p),sind Konsonanten. (die Buchstaben t und p),son consonantes. (las letras t y p),sont des consonnes. (les lettres t et p)
_saydwt,Are you finished with these words?,Вы закончили с этими словами?,Sind Sie mit diesen Wörtern fertig?,¿Has terminado con estas palabras?,Vous en avez fini avec ces mots?
_larr,"""arr"" (the letters)",неаранжировка (буквы),ARR (die Buchstaben),ARR (las letras),ARR (les lettres)
_saavty,"As a vowel team, you know that letters ""“ie”"" make long vowel sounds.","Как гласная команда, вы знаете, что буквы «IE» делают длинные гласные звуки.","Als Vokal-Team wissen Sie, dass Buchstaben IE lange Vokal-Töne bilden.","Como equipo vocal, usted sabe que las letras IE hacen sonidos vocales largos.","En tant qu'équipe de voyelles, vous savez que les lettres IE font de longs sons de voyelles."
_saensw,"As each new sight word is introduced, the computer will record it in your electronic sight word notebook.","После того как будет введено каждое новое слово, компьютер зарегистрирует его в блокноте электронного слова.","Da jedes neue Sight Word eingeführt wird, wird der Computer es in Ihrem elektronischen Sight Word-Notizbuch aufzeichnen.","A medida que se introduce cada nueva palabra de vista, el ordenador lo grabará en su cuaderno electrónico de palabras de vista.","Comme chaque nouveau mot de vue est introduit, l'ordinateur l'enregistrera dans votre cahier de mot de vue électronique."
_saitw,as in the word...,как и в слове...,wie im Wort ...,como en la palabra ...,comme dans le mot ...
_sayhpo,"As you have practiced, “ow” also makes the sound of long “o”.","Как вы практиковали, Ай также делает звук длинного o.","Wie Sie geübt haben, macht ow auch den Klang langer o.","Como usted ha practicado, ow también hace el sonido de o largo.","Comme vous l'avez pratiqué, OW fait aussi le son de long o."
_sasyou,"As you may have guessed by now, all the syllable types seem to have ""an"" exception or two.","Как вы уже догадались, все слоговые типы, похоже, имеют исключение или два.","Wie Sie vielleicht schon erraten haben, scheinen alle Silben-Typen eine Ausnahme oder zwei zu haben.","Como usted puede haber adivinado por ahora, todos los tipos de sílabas parecen tener una excepción o dos.","Comme vous avez pu le deviner maintenant, tous les types de syllabes semblent avoir une exception ou deux."
_saloli,At least one letter in that word is silent.,По крайней мере одна буква в этом слове хранит молчание.,Mindestens ein Buchstabe in diesem Wort schweigt.,Al menos una letra en esa palabra es silenciosa.,Au moins une lettre dans ce mot est silencieuse.
_lau,"""au"" (the letters)",АС (письма),Au (die Buchstaben),au (las letras),au (les lettres)
_sau,"""au"" (the sounds)",Au (звуки),Au (die Klänge),au (los sonidos),au (les sons)
_laugh,augh (the letters),аугх (буквы),AUGH (die Buchstaben),augh (las letras),Augh (les lettres)
_saugh,"""augh1"" (the sounds)",аугх1 (звуки),augh1 (die Klänge),augh1 (los sonidos),augh1 (les sons)
_saugh2,"""augh2"" (as in LAUGH)",аугх2 (как смех),augh2 (wie im lachen),augh2 (como en risa),augh2 (comme dans rire)
_law,"""aw"" (the letters)",Ох (буквы),AW (die Buchstaben),AW (las letras),AW (les lettres)
_saw,"""aw"" (the sounds)",о (звуки),AW (die Sounds),AW (los sonidos),AW (les sons)
_lay,"""ay"" (the letters)",Ай (буквы),ay (die Buchstaben),Ay (las letras),Ay (les lettres)
_say,"""ay"" (the sounds)",Ай (звуки),ay (die Klänge),Ay (los sonidos),Ay (les sons)
_sasmt8,bass (pause) bass,бас-гитара,Bass (Pause),bajo (pausa) bajo,basse (pause) Bass
_sbstst1,"""Be"" sure to say the sound of each letter and blend them together.",Не забудьте сказать о звуке каждой буквы и смешать их вместе.,"Achten Sie darauf, den Klang jedes Buchstabens zu sagen und vermischen Sie sie zusammen.",Asegúrese de decir el sonido de cada letra y mezclar juntos.,N'oubliez pas de dire le son de chaque lettre et de les mélanger ensemble.
_sbtfsc,"Because the first syllable, “cli”, is open, the letter ""“i”"" makes the long ""“i”sound"".","Поскольку первый слог, CLI, открыт, буква i делает длинную i звуком.","Da die erste Silbe, CLI, offen ist, macht der Buchstabe i den langen i Klang.","Porque la primera sílaba, CLI, está abierta, la letra i hace el sonido i largo.","Parce que la première syllabe, CLI, est ouverte, la lettre i fait le long i son."
_sblend,Blend the sounds in each syllable.,Наложение звуков в каждом слоге.,Mischen Sie die Töne in jeder Silbe.,Mezcle los sonidos en cada sílaba.,Mélanger les sons dans chaque syllabe.
_sbiimo,but it is most often at the end.,но чаще всего это в конце.,aber es ist am häufigsten am Ende.,pero es más a menudo al final.,mais c'est le plus souvent à la fin.
_sbtacta,But they are crunched together and the sounds are hard to separate.,"Но они проводят вместе, и звуки трудно разделять.",Aber Sie werden zusammen crunched und die Töne sind schwer zu trennen.,Pero son crujidos juntos y los sonidos son difíciles de separar.,Mais ils sont croqués ensemble et les sons sont difficiles à séparer.
_sbwicw,"But, when it ""combibines"" with a vowel to form a single sound, it is called a ""semi-vowel"".","Но, когда он комбибинес с гласной, чтобы сформировать единый звук, он называется полупрозрачным.","Aber wenn es mit einem Vokal combibines, um einen einzigen Klang zu bilden, wird er als Semi-Vokal bezeichnet.","Pero, cuando se combibines con una vocal para formar un solo sonido, se llama semivocal.","Mais, quand il combibines avec une voyelle pour former un seul son, il est appelé une voyelle semi."
_sc,"""c"" (hard- the sound)",c (жестко-звук),c (Hard-der Klang),c (Hard-el sonido),c (Hard-le son)
_scs,"""c"" (soft - the sound)",c (мягкий звук),c (weich-der Klang),c (suave-el sonido),c (soft-le son)
_lch,"""ch"" (the letters)",CH (буквы),ch (die Buchstaben),CH (las letras),ch (les lettres)
_sch,"""ch"" (the sounds)",CH (звуки),ch (die Klänge),CH (los sonidos),ch (les sons)
_schoos,"Choose a word from Column ""B"" to tack onto a word in Column A to form new compound word.","Выберите слово из столбца B, чтобы присвоить слово в столбце a для создания нового составного слова.","Wählen Sie ein Wort aus Spalte B auf Tack auf ein Wort in Spalte a, um neue zusammengesetzte Wort zu bilden.",Elija una palabra de la columna B para virar sobre una palabra en la columna a para formar una nueva palabra compuesta.,Choisissez un mot de la colonne B pour épingler un mot dans la colonne a pour former un nouveau mot composé.
_sctccs,"Choose the correct consonant -""le"" syllable to tack onto.","Выберите правильный согласный-Ле-слог, чтобы прибыть на него.",Wählen Sie die richtige Konsonanten-Le Silbe zu Tack auf.,Elegir la consonante correcta-le sílaba para virar sobre.,Choisissez la bonne consonne-le syllabe à clouer sur.
_sctcwt,Choose the correct word to put in the blank.,"Выберите нужное слово, чтобы поместить его в пустое поле.","Wählen Sie das richtige Wort, um das Leerzeichen zu setzen.",Elija la palabra correcta para poner en blanco.,Choisissez le mot correct à mettre dans le vide.
_lck,"""ck"" (the letters)",Чешская крона (буквы),ck (die Buchstaben),CK (las letras),CK (les lettres)
_sck,"""ck"" (the sounds)",Чешская крона (звуки),ck (die Klänge),CK (los sonidos),CK (les sons)
_sclait,"""cl"", as in the word clap","CL, как в слове «хлопок»","cl, wie im Wort klatschen","cl, como en la palabra Clap","CL, comme dans le mot Clap"
