
_scoawa,Click on a word at the top of your screen to complete the sentence.,"Чтобы завершить предложение, щелкните слово вверху экрана.","Klicken Sie auf ein Wort oben auf Ihrem Bildschirm, um den Satz abzuschließen.",Haga clic en una palabra en la parte superior de la pantalla para completar la oración.,Cliquez sur un mot en haut de votre écran pour terminer la phrase.
_scooot1,"Click on one of the suffixes in Column ""B"" to make a word.","Щелкните один из суффиксов в столбце B, чтобы сделать слово.","Klicken Sie auf eines der Suffixe in Spalte B, um ein Wort zu erstellen.",Haga clic en uno de los sufijos de la columna B para hacer una palabra.,Cliquez sur l'un des suffixes de la colonne B pour faire un mot.
_scooot,Click on one of the three syllables to make a complete word.,"Щелкните один из трех слогов, чтобы сделать полное слово.","Klicken Sie auf eine der drei Silben, um ein komplettes Wort zu machen.",Haga clic en una de las tres sílabas para hacer una palabra completa.,Cliquez sur l'une des trois syllabes pour faire un mot complet.
_scotaf,Click on the answer for this question from the list below.,Щелкните ответ на этот вопрос из приведенного ниже списка.,Klicken Sie auf die Antwort für diese Frage aus der untenstehenden Liste.,Haga clic en la respuesta para esta pregunta de la lista de abajo.,Cliquez sur la réponse à cette question dans la liste ci-dessous.
_scotbt,Click on the blend to select the word.,"Щелкните на переходе, чтобы выбрать слово.","Klicken Sie auf die Blend, um das Wort auszuwählen.",Haga clic en la mezcla para seleccionar la palabra.,Cliquez sur le Blend pour sélectionner le mot.
_scotct1,"Click on the column that makes the same sound of ""c""as the word on your screen.","Щелкните столбец, который делает тот же звук, что и для ЦС, на экране.","Klicken Sie auf die Spalte, die den gleichen Klang von CAS das Wort auf Ihrem Bildschirm macht.",Haga clic en la columna que hace el mismo sonido de CAS la palabra en la pantalla.,Cliquez sur la colonne qui fait le même son de cas le mot sur votre écran.
_scotct,"Click on the column that makes the same sound of ""“ed”"" as the word on your screen.","Щелкните столбец, который делает тот же звук «Эд», что и слово на экране.","Klicken Sie auf die Spalte, die den gleichen Klang von Ed wie das Wort auf Ihrem Bildschirm macht.",Haga clic en la columna que hace el mismo sonido de Ed como la palabra en la pantalla.,Cliquez sur la colonne qui fait le même son de Ed comme le mot sur votre écran.
_scotctm,"Click on the column that makes the same sound of ""g""as the word on your screen.","Щелкните столбец, который делает тот же звук, что и слово на экране.","Klicken Sie auf die Spalte, die den gleichen Klang von Gas das Wort auf Ihrem Bildschirm macht.",Haga clic en la columna que hace el mismo sonido de gas la palabra en la pantalla.,Cliquez sur la colonne qui fait le même son de gaz le mot sur votre écran.
_scotlc,Click on the left column if the “c” is hard.,"Щелкните левый столбец, если c трудно.","Klicken Sie auf die linke Spalte, wenn das c schwer ist.",Haga clic en la columna de la izquierda si la c es dura.,Cliquez sur la colonne de gauche si le c est difficile.
_scotlc1,Click on the left column if the “g” is hard.,"Щелкните левый столбец, если g трудно.","Klicken Sie auf die linke Spalte, wenn das g schwer ist.",Haga clic en la columna de la izquierda si la g es dura.,Cliquez sur la colonne de gauche si le g est difficile.
_scotla,Click on the letter and compare its sound to your recording.,Щелкните букву и сравните ее звук с записью.,Klicken Sie auf den Buchstaben und vergleichen Sie den Klang mit ihrer Aufnahme.,Haga clic en la carta y compare su sonido con su grabación.,Cliquez sur la lettre et comparez son son à votre enregistrement.
_scotlt,Click on the letter that makes the sound.,"Щелкните букву, которая делает звук.","Klicken Sie auf den Buchstaben, der den Klang macht.",Haga clic en la letra que hace el sonido.,Cliquez sur la lettre qui fait le son.
_scotla2,Click on the letters and compare their sound to your recording.,Щелкните буквы и сравните их звук с записью.,Klicken Sie auf die Buchstaben und vergleichen Sie Ihren Klang mit ihrer Aufzeichnung.,Haga clic en las letras y comparar su sonido a su grabación.,Cliquez sur les lettres et comparez leur son à votre enregistrement.
_scotoi,Click on the one I say.,"Щелкните на той, что я говорю.","Klicken Sie auf das, was ich sage.",Haga clic en el que digo.,Cliquez sur celui que je dis.
_scltrc,Click on the right column if the “c” is soft.,"Щелкните правый столбец, если c является мягким.","Klicken Sie auf die Rechte Spalte, wenn das c weich ist.",Haga clic en la columna de la derecha si la c es blanda.,Cliquez sur la colonne de droite si le c est doux.
_scltrc1,Click on the right column if the “g” is soft.,"Щелкните правый столбец, если g является мягким.","Klicken Sie auf die Rechte Spalte, wenn das g weich ist.",Haga clic en la columna de la derecha si la g es blanda.,Cliquez sur la colonne de droite si le g est doux.
_scotst2,Click on the syllable to the left of this syllable to hear the rule.,"Щелкните по слогу слева от этого слога, чтобы услышать правило.","Klicken Sie auf die Silbe Links von dieser Silbe, um die Regel zu hören.",Haga clic en la sílaba a la izquierda de esta sílaba para escuchar la regla.,Cliquez sur la syllabe à gauche de cette syllabe pour entendre la règle.
_scotst1,Click on the syllable to the right of this syllable to hear the rule.,"Щелкните слог справа от этого слога, чтобы услышать правило.","Klicken Sie auf die Silbe rechts neben dieser Silbe, um die Regel zu hören.",Haga clic en la sílaba a la derecha de esta sílaba para escuchar la regla.,Cliquez sur la syllabe à droite de cette syllabe pour entendre la règle.
_scotst,Click on the syllable type for this syllable from the list below.,Щелкните тип слога для этого слога из приведенного ниже списка.,Klicken Sie auf die Silbe-Typ für diese Silbe aus der untenstehenden Liste.,Haga clic en el tipo de sílaba de esta sílaba de la lista de abajo.,Cliquez sur le type de syllabe pour cette syllabe dans la liste ci-dessous.
_scotwa1,Click on the word and compare it to your recording.,Щелкните слово и сравните его с записью.,Klicken Sie auf das Wort und vergleichen Sie es mit ihrer Aufnahme.,Haga clic en la palabra y compárelo con su grabación.,Cliquez sur le mot et le comparer à votre enregistrement.
_scotwa,Click on the word and compare its sound to your recording.,Щелкните слово и сравните его звук с записью.,Klicken Sie auf das Wort und vergleichen Sie Ihren Klang mit ihrer Aufnahme.,Haga clic en la palabra y compare su sonido con su grabación.,Cliquez sur le mot et comparez son son à votre enregistrement.
_scowft,Click on words from the list below to complete the sentence.,"Чтобы завершить предложение, щелкните слова из приведенного ниже списка.","Klicken Sie auf Wörter aus der Liste unten, um den Satz abzuschließen.",Haga clic en las palabras de la lista de abajo para completar la frase.,Cliquez sur les mots de la liste ci-dessous pour terminer la phrase.
_sctrba2,Click the record button and say the word on the screen.,Нажмите кнопку записи и скажите слово на экране.,"Klicken Sie auf die Schaltfläche Record, und sagen Sie das Wort auf dem Bildschirm.",Haga clic en el botón grabar y diga la palabra en la pantalla.,Cliquez sur le bouton enregistrer et prononcez le mot à l'écran.
_scotwo,Click the words on the right that match the numbers on the left.,"Щелкните слова справа, совпадающие с номерами слева.","Klicken Sie auf die Wörter rechts, die den Nummern auf der linken Seite entsprechen.",Haga clic en las palabras de la derecha que coinciden con los números de la izquierda.,Cliquez sur les mots à droite qui correspondent aux nombres à gauche.
_hcft,"Click this button to transfer a copy of your student history files to a Language Tune-""Up"" Kit For Schools system.","Нажмите эту кнопку, чтобы перенести копию файлов студенческой истории в комплект для обучения на языковой системе.","Klicken Sie auf diese Schaltfläche, um eine Kopie Ihrer Kursteilnehmer-History-Dateien in ein Language Tune-up Kit für Schulen zu übertragen.",Haga clic en este botón para transferir una copia de los archivos de su historial estudiantil a un kit de ajuste de idioma para el sistema escolar.,Cliquez sur ce bouton pour transférer une copie de vos dossiers d'histoire d'étudiant dans un kit de tune-up de langue pour le système d'écoles.
_scswte,Closed syllable words that end in...,"Закрытые слоговые слова, которые заканчиваются...",Geschlossene Silbe words that End in ...,Sílabas cerradas palabras que terminan en. ..,Mots de syllabe fermés qui finissent en ...
_scolum,Column A contains the first syllables of three words.,Столбец A содержит первые слоги из трех слов.,Spalte A enthält die ersten Silben von drei Wörtern.,La columna a contiene las primeras sílabas de tres palabras.,La colonne A contient les premières syllabes de trois mots.
_scbcts,"Column ""B"" contains the second syllables of three words.",Столбец B содержит вторые слоги из трех слов.,Spalte B enthält die zweiten Silben von drei Wörtern.,La columna B contiene las segundas sílabas de tres palabras.,La colonne B contient les deuxièmes syllabes de trois mots.
_sctsbb,Complete the sentence below by typing in the missing word.,"Заполните приведенное ниже предложение, введя недостающее слово.","Vervollständigen Sie den nachfolgenden Satz, indem Sie das fehlende Wort eingeben.",Complete la frase siguiente escribiendo la palabra que falta.,Complétez la phrase ci-dessous en tapant le mot manquant.
_scwamu,"Compound words are made ""up"" of two one syllable words.",Составные слова составляют 2 1 слоговых слов.,Zusammengesetzte Wörter bestehen aus 2 1 Silben Wörtern.,Las palabras compuestas se componen de 2 1 palabras de sílaba.,Les mots composés sont constitués de 2 1 syllabes.
_scompo,Compound words are words in which two one syllable words are joined together to make one word.,"Составные слова — это слова, в которых 2 1 слоговых слов объединяются, чтобы сделать одно слово.","Zusammengesetzte Wörter sind Wörter, in denen 2 1 Silben Wörter zusammengefügt werden, um ein Wort zu bilden.",Las palabras compuestas son palabras en las que las palabras de sílaba 2 1 se unen para hacer una palabra.,Les mots composés sont des mots dans lesquels 2 1 mots de syllabe sont réunis pour faire un mot.
_scwhto,Compound words have two one syllable words which are joined together to make one word.,"Составные слова имеют 2 1 слоговых слов, которые объединились, чтобы сделать одно слово.","Zusammengesetzte Wörter haben 2 1 Silben Wörter, die zusammengefügt werden, um ein Wort zu bilden.",Las palabras compuestas tienen 2 1 palabras de sílaba que se unen para hacer una sola palabra.,Mots composés ont 2 1 Mots syllabe qui sont réunis pour faire un mot.
_scw1,compound words.,составные слова.,zusammengesetzte Wörter.,palabras compuestas.,des mots composés.
_wcongra,Congratulations!,Поздравляю!,Herzlichen Glückwunsch!,Felicitaciones!,Félicitations!
_scdatc,Consonant digraphs are two consonants that weld together to make a new sound.,"Согласные с двумя согласными, которые объединяются для создания нового звука.","Konsonanten sind zwei Konsonanten, die zusammen Schweißen, um einen neuen Klang zu bilden.",Las digrafías consonantes son dos consonantes que sueldan juntas para hacer un nuevo sonido.,Les digrammes consonnes sont deux consonnes qui soudent ensemble pour faire un nouveau son.
_scd,consonant digraphs.,созвучные расграфы.,Konsonanten.,digramas de consonantes.,des digrammes consonnes.
_scarto,Consonants are all the other letters that are not vowels.,"Согласные-это все остальные буквы, которые не являются гласными.","Konsonanten sind alle anderen Buchstaben, die keine Vokale sind.",Las consonantes son todas las otras letras que no son vocales.,Les consonnes sont toutes les autres lettres qui ne sont pas des voyelles.
_scaoby,"Consonants are obstructed by your teeth, (""ch""- cheese), your mouth, (""th"" -these), or your lips, (""p"" - pig).","Согласные с вашими зубами, (CH-сыр), твоим ртом, (т. е.) или вашими губами, (p-свинью).","Die Konsonanten werden durch ihre Zähne, (CH-Käse), ihren Mund, (Th-diese) oder Ihre Lippen (p-Schwein) behindert.","Las consonantes son obstruidas por tus dientes, (CH-Cheese), tu boca, (TH-estos), o tus labios, (p-Pig).","Les consonnes sont obstruées par vos dents, (ch-fromage), votre bouche, (Th-these), ou vos lèvres, (p-cochon)."
_sdeipt,Data error in sound pronunciation table. Call vendor.,Ошибка данных в таблице звукового произношения. Позвонить поставщику.,Daten-Fehler in der Sound Aussprache-Tabelle. Verkäufer anrufen.,Error de datos en la tabla de Pronunciación de sonido. Llame a un vendedor.,Erreur de données dans la table de prononciation sonore. Appelez le vendeur.
_wdelay5,"delay .""5"" second",задержка. 5 секунд,Verzögerung. 5 Sekunden,demora. 5 segundos,retard. 5 secondes
_wdelay1,"delay ""1"".""0"" second","задержка 1,0 секунды","Verzögerung 1,0 Sekunden","demora 1,0 segundos","Delay 1,0 seconde"
_wdelay2,"delay ""2"".""0"" seconds","задержка 2,0 секунд","Verzögerung 2,0 Sekunden","demora 2,0 segundos","Delay 2,0 seconds"
_sdotctf,"Depending on the consonant that follows the letters ""al"", the letter ""a"" will make the sound of double dotted ""a"".","В зависимости от согласных, которые соответствуют буквам Al, буква a сделает звук двойной пунктирной.","Abhängig vom Konsonanten, der den Buchstaben Al folgt, wird der Buchstabe a den Klang doppelter gepunktete a bilden.","Dependiendo de la consonante que sigue las letras al, la letra a hará el sonido de doble punteado a.","Selon la consonne qui suit les lettres al, la lettre a fera le son de double pointillé a."
_ldge,"""dge"" (the letters)",Дже (буквы),DGE (die Buchstaben),DGE (las letras),DGE (les lettres)
_sdyhts,Did you hear the sound made by the letter “c” in the word “ceiling”?,"Вы слышали звук, сделанный буквой с в слове верхний предел?","Hörten Sie den Klang, der durch den Buchstaben c im Wort Decke gebildet wurde?",¿escuchó el sonido hecho por la letra c en la palabra techo?,Avez-vous entendu le son fait par la lettre c dans le mot plafond?
_sdivid,Divide that word into syllables.,Разделите это слово на слоги.,Teilen Sie dieses Wort in Silben.,Divida esa palabra en sílabas.,Diviser ce mot en syllabes.
_sdtwbt2,Divide the syllables between the consonant and the last vowel.,Разделить слоги между согласными и последними гласными.,Dividieren Sie die Silben zwischen dem Konsonanten und dem letzten Vokal.,Divida las sílabas entre la consonante y la vocal pasada.,Diviser les syllabes entre la consonne et la dernière voyelle.
_sdtwbt,Divide the syllables between two or more consonants which fall between two vowels.,"Разделите слоги между двумя или более согласными, которые делятся между двумя гласными.","Dividieren Sie die Silben zwischen zwei oder mehr Konsonanten, die zwischen zwei Vokale fallen.",Divida las sílabas entre dos o más consonantes que caen entre dos vocales.,Diviser les syllabes entre deux ou plusieurs consonnes qui tombent entre deux voyelles.
_sdtwis,Divide the word into syllables.,Разделить слово на слоги.,Teilen Sie das Wort in Silben.,Divida la palabra en sílabas.,Diviser le mot en syllabes.
_sdytts,Do you think they sound the same?,"Думаешь, они звучат одинаково?","Glaubst du, Sie klingen das gleiche?",¿Crees que suenen igual?,Pensez-vous qu'ils sonnent la même chose?
_sdywte,Do you want to exit?,Вы хотите выйти?,Möchtest du aussteigen?,¿desea salir?,Voulez-vous quitter?
_sdylss1,Do your letter sounds sound like mine?,Ваше письмо звучит как мой?,Hört Ihr Brief klingt wie meine?,¿tu carta suena como la mía?,Votre lettre sonne comme la mienne?
_sdoest,"Does the ""e"" make a sound?",У меня есть звук?,Macht das e einen Klang?,¿el e hace un sonido?,Est-ce que l'e fait un son?
_sdyass,"Does your ""a"" sound sound like mine?","Ты звук, как мой?",Bist du ein Klang wie meiner?,¿eres un sonido como el mío?,Vous êtes un son comme le mien?
_sdwas,"Don'""t"" worry about spelling it correctly.",Не беспокойтесь о правильном написании.,Machen Sie sich keine Sorgen über Rechtschreibung richtig.,No te preocupes por deletrearlo correctamente.,Ne vous inquiétez pas de l'épeler correctement.
_lddi,"Double dotted ""i"" (the letters).",Двойная пунктирная линия i (буквы).,Doppelt gepunktete i (die Buchstaben).,Doble punteado i (las letras).,Double pointillé i (les lettres).
_lddo,"Double Dotted ""O""",Двойная пунктирная O,Doppelte gepunktete O,Doble punteado O,Double pointillé O
_lddy,double dotted Y,двойная пунктирная Y,doppelt gepunktete Y,doble punteado Y,double pointillé Y
_ldr,"""dr"" (the letters)",д-р (письма),Dr (die Buchstaben),Dr (las letras),Dr (les lettres)
_lea,"""ea"" (the letters)",EA (буквы),EA (die Buchstaben),EA (las letras),EA (les lettres)
_sea1,"""ea1"" (the sounds - EAT)",еа1 (звуки-едят),EA1 (die Klänge-EAT),EA1 (los sonidos-comen),EA1 (les sons-EAT)
_sea2,"""ea2"" (the sounds - HEAD)",еа2 (звуки-голова),EA2 (The Sounds-Head),EA2 (la cabeza de los sonidos),EA2 (The Sounds-Head)
_sea3,"""ea3"" (the sounds - STEAK)",еа3 (звуки-стейк),EA3 (The Sounds-Steak),ea3 (los sonidos-filete),EA3 (les sons-steak)
_selmio,Each letter makes its own sound.,Каждая буква делает свой собственный звук.,Jeder Brief macht seinen eigenen Klang.,Cada letra hace su propio sonido.,Chaque lettre fait son propre son.
_seswha,Each sound will have a keyword to help you remember it.,"Каждый звук будет иметь ключевое слово, помогающее запомнить его.","Jeder Klang wird ein Stichwort haben, um Sie daran zu erinnern.",Cada sonido tendrá una palabra clave para ayudarle a recordarlo.,Chaque son aura un mot-clé pour vous aider à vous en souvenir.
_seusha,Each unique sound has a keyword associated with it.,Каждый уникальный звук имеет связанное с ним ключевое слово.,Jeder eindeutige Klang hat ein Schlüsselwort zugeordnet.,Cada sonido único tiene una palabra clave asociada a ella.,Chaque son unique a un mot-clé qui lui est associé.
_sevmmd,Each vowel makes many different sounds.,Каждая гласная имеет много разных звуков.,Jeder Vokal macht viele verschiedene Klänge.,Cada vocal hace muchos sonidos diferentes.,Chaque voyelle fait beaucoup de sons différents.
_lear,ear (the letters),ухо (буквы),Ohr (die Buchstaben),oreja (las letras),oreille (les lettres)
_led,"""ed"" (the letters)",Эд (буквы),Ed (die Buchstaben),Ed (las letras),Ed (les lettres)
_sedd,"""edd"" (the sound of /""d""/)",ЕДД (звук/д/),EDD (The Sound of/d/),EDD (el sonido de/),EDD (le son de/d/)
_sedt,"""edt"" (the sound of /""t""/)",EDT (звук/т/),EDT (der Klang des/t/),EDT (el sonido de/),EDT (le son de/)
_lee,"""ee"" (the letters)",ee (буквы),EE (die Buchstaben),EE (las letras),EE (les lettres)
_see,"""ee"" (the sounds)",ee (звуки),EE (die Klänge),EE (los sonidos),EE (les sons)
_lei,"""ei"" (the letters)",МАП (письма),Ei (die Buchstaben),EI (las letras),EI (les lettres)
_leigh,"""eigh"" (the letters)",еигх (буквы),Eigh (die Buchstaben),eigh (las letras),... (les lettres)
_seigh,"""eigh"" (the sounds)",еигх (звуки),Eigh (die Klänge),eigh (los sonidos),... (les sons)
_see2,"eighteen, eighteenth",Восемнадцать,"achtzehn, achtzehnten","dieciocho, decimoctavo","dix-huit, dix-huitième"
_see1,"eleven, eleventh",Одиннадцать,"Elf, elfte","once, undécimo","onze, onzième"
_seisrw,Employ is the root word.,Использование — это корневое слово.,Beschäftigen ist das Wurzel-Wort.,Emplear es la palabra raíz.,Employer est le mot racine.
_len,"""en"" (the letters).",EN (буквы).,en (die Buchstaben).,en (las letras).,fr (les lettres).
_leng,"""eng"" (the letters)",(буквы),deu (die Buchstaben),ENG (las letras),eng (les lettres)
_seng,"""eng"" (the sound)",(звук),deu (der Klang),ENG (el sonido),eng (le son)
_lenk,"""enk"" (the letters)",ЕНК (буквы),ENK (die Buchstaben),Enk (las letras),ENK (les lettres)
_senk,"""enk"" (the sound)",ЕНК (звук),ENK (der Klang),Enk (el sonido),ENK (le son)
_seyiya,"Enter ""Y"" if yes, and ""N"" if ""no"".","Введите Y, если да, и N, если нет.","Geben Sie Y, wenn ja, und N, wenn Nein.","Introduzca y si sí, y n si no.","Entrez Y si oui, et N si non."
_seatlit,"Enter all of the letters in the ""r-controlled"" syllable.",Введите все буквы в слоге под управлением r.,Geben Sie alle Buchstaben in die r-kontrollierte Silbe ein.,Escriba todas las letras de la sílaba controlada por r.,Entrez toutes les lettres dans la syllabe r-contrôlée.
_seaotli,"Enter all of the letters in the syllable that contains the letter ""c"".","Введите все буквы в слоге, содержащем букву c.","Geben Sie alle Buchstaben in der Silbe ein, die den Buchstaben c enthält.",Introduzca todas las letras de la sílaba que contiene la letra c.,Saisissez toutes les lettres de la syllabe contenant la lettre c.
_seaotl,"Enter all of the letters in the syllable that contains the letter ""g"".","Введите все буквы в слоге, содержащие букву g.","Geben Sie alle Buchstaben in der Silbe ein, die den Buchstaben g enthält.",Introduzca todas las letras de la sílaba que contiene la letra g.,Saisissez toutes les lettres de la syllabe qui contient la lettre g.
_setbww,"Enter the base word without the added ""s"".",Введите базовое слово без добавления s.,Geben Sie das Basis-Wort ohne die hinzugefügten s ein.,Introduzca la palabra base sin el valor añadido s.,Entrez le mot de base sans l'ajout de s.
_setkft,Enter the keyword for that sound.,Введите ключевое слово для этого звука.,Geben Sie das Schlüsselwort für diesen Sound ein.,Escriba la palabra clave para ese sonido.,Saisissez le mot-clé pour ce son.
_setlei,"Enter the letter ""E"" if you think the vowel is ""E"".","Введите букву e, если вы считаете, что гласный-е.","Geben Sie den Buchstaben e ein, wenn Sie denken, dass der Vokal e ist.",Escriba la letra e si cree que la vocal es e.,Entrez la lettre e si vous pensez que la voyelle est e.
_setlii,"Enter the letter ""I"" if you think the vowel is ""I"".","Введите букву i, если вы считаете, что гласный-это я.","Geben Sie den Buchstaben i, wenn Sie denken, der Vokal ist i.",Escriba la letra i si cree que la vocal es i.,Entrez la lettre i si vous pensez que la voyelle est i.
_setlsit,"Enter the letter ""s"" if the vowel is short, or ""l"", if the vowel is long.","Введите букву s, если гласный короче, или l, если гласный длинный.","Geben Sie den Buchstaben s ein, wenn der Vokal kurz oder l ist, wenn der Vokal lang ist.","Ingrese la letra s si la vocal es corta, o l, si la vocal es larga.","Entrez la lettre s si la voyelle est courte, ou l, si la voyelle est longue."
_setlft,Enter the letter for that sound.,Введите букву для этого звука.,Geben Sie den Buchstaben für diesen Klang ein.,Escriba la letra para ese sonido.,Entrez la lettre pour ce son.
